{
  "event_type": "promotion.outcome.created",
  "schema_version": 1,
  "outcome_id": "OUT-DEC-SCN-20260718-LONDON_CENTRAL-ICE500",
  "decision_id": "DEC-SCN-20260718-LONDON_CENTRAL-ICE500",
  "scenario_id": "SCN-20260718-LONDON_CENTRAL-ICE500",
  "simulated_at": "2026-07-18T06:00:02Z",
  "simulator_version": "v1",
  "scenario": {
    "date": "2026-07-18",
    "store_id": "LONDON_CENTRAL",
    "store_name": "London Central",
    "sku_id": "ICE500",
    "sku_name": "Ice Cream 500ml",
    "category": "ice_cream",
    "price": 5.0,
    "cost": 3.0,
    "stock": 320,
    "baseline_sales": 100,
    "stock_level": "high",
    "day_type": "weekend",
    "weather": "hot",
    "temperature_c": 31.0,
    "event_type": "local_event",
    "event_note": "concert_nearby"
  },
  "decision": {
    "discount": 20
  },
  "outcome": {
    "units_sold": 320,
    "gross_profit": 320.0
  }
}
